{
  "contourIndex": 0,
  "coordinateSpace": "pixel-y-up",
  "fixtureID": "uni0038",
  "path": {
    "elements": [
      {
        "type": "move",
        "x": 114.45521974320262,
        "y": 429.44033529820734
      },
      {
        "points": [
          [
            114.45521974320262,
            432.9594185294813
          ],
          [
            111.51436959359664,
            433.2637353004005
          ],
          [
            108.59439874711053,
            434.6177931720235
          ]
        ],
        "type": "curve"
      },
      {
        "points": [
          [
            68.50679164608587,
            453.2073417680284
          ],
          [
            43.832460732984295,
            482.7025754275629
          ],
          [
            43.832460732984295,
            528.3690224850029
          ]
        ],
        "type": "curve"
      },
      {
        "points": [
          [
            43.832460732984295,
            616.8120931956846
          ],
          [
            125.17281742280707,
            653.8324507402697
          ],
          [
            202.47459320541435,
            653.8324507402697
          ]
        ],
        "type": "curve"
      },
      {
        "points": [
          [
            281.6186589533291,
            653.8324507402697
          ],
          [
            367.99999999999994,
            619.9697514124889
          ],
          [
            367.99999999999994,
            527.6474364802439
          ]
        ],
        "type": "curve"
      },
      {
        "points": [
          [
            367.99999999999994,
            484.30858950633086
          ],
          [
            342.46364274332046,
            452.6007067899816
          ],
          [
            304.05605902870815,
            435.1196910457123
          ]
        ],
        "type": "curve"
      },
      {
        "points": [
          [
            301.1206893738081,
            433.7836725256762
          ],
          [
            297.19863041655964,
            433.4589633962748
          ],
          [
            297.19863041655964,
            429.55733652285915
          ]
        ],
        "type": "curve"
      },
      {
        "points": [
          [
            297.19863041655964,
            426.4940399783414
          ],
          [
            300.5333201000781,
            426.5650861098803
          ],
          [
            302.8414158826923,
            425.7496266140823
          ]
        ],
        "type": "curve"
      },
      {
        "points": [
          [
            355.497459799174,
            407.14603513997963
          ],
          [
            391.1208875057263,
            361.5263390463835
          ],
          [
            391.1208875057263,
            304.7449868876633
          ]
        ],
        "type": "curve"
      },
      {
        "points": [
          [
            391.1208875057263,
            195.0905161600528
          ],
          [
            303.5931153814677,
            154.49609375000003
          ],
          [
            206.48029863363303,
            154.49609375000003
          ]
        ],
        "type": "curve"
      },
      {
        "points": [
          [
            109.2157117320031,
            154.49609375000003
          ],
          [
            20.64586630296567,
            194.10186001132894
          ],
          [
            20.64586630296567,
            304.51261023276385
          ]
        ],
        "type": "curve"
      },
      {
        "points": [
          [
            20.64586630296567,
            356.9437307341714
          ],
          [
            60.02090291680866,
            406.1132341296517
          ],
          [
            107.84682850992087,
            425.00168996516703
          ]
        ],
        "type": "curve"
      },
      {
        "points": [
          [
            110.1422858392961,
            425.90826195202385
          ],
          [
            114.45521974320262,
            426.3624573724198
          ],
          [
            114.45521974320262,
            429.44033529820734
          ]
        ],
        "type": "curve"
      },
      {
        "type": "close"
      }
    ]
  },
  "schemaVersion": 1,
  "sourceRevision": "23073ca08ecdac61ad0e838bfae49a590bc2c7cc",
  "stage": "initialFit"
}