{
  "contours": [
    {
      "closed": true,
      "index": 0,
      "path": {
        "elements": [
          {
            "type": "move",
            "x": 80.0,
            "y": 1008.0
          },
          {
            "type": "line",
            "x": 80.0,
            "y": 272.0
          },
          {
            "type": "line",
            "x": 96.0,
            "y": 256.0
          },
          {
            "type": "line",
            "x": 168.0,
            "y": 256.0
          },
          {
            "type": "line",
            "x": 184.0,
            "y": 272.0
          },
          {
            "type": "line",
            "x": 182.0,
            "y": 856.0
          },
          {
            "type": "line",
            "x": 196.0,
            "y": 856.0
          },
          {
            "type": "line",
            "x": 590.0,
            "y": 256.0
          },
          {
            "type": "line",
            "x": 678.0,
            "y": 256.0
          },
          {
            "type": "line",
            "x": 694.0,
            "y": 272.0
          },
          {
            "type": "line",
            "x": 694.0,
            "y": 1008.0
          },
          {
            "type": "line",
            "x": 678.0,
            "y": 1024.0
          },
          {
            "type": "line",
            "x": 606.0,
            "y": 1024.0
          },
          {
            "type": "line",
            "x": 590.0,
            "y": 1008.0
          },
          {
            "type": "line",
            "x": 592.0,
            "y": 424.0
          },
          {
            "type": "line",
            "x": 578.0,
            "y": 424.0
          },
          {
            "type": "line",
            "x": 184.0,
            "y": 1024.0
          },
          {
            "type": "line",
            "x": 96.0,
            "y": 1024.0
          },
          {
            "type": "line",
            "x": 80.0,
            "y": 1008.0
          },
          {
            "type": "close"
          }
        ]
      }
    }
  ],
  "coordinateSpace": "canonical-y-up",
  "fixtureID": "uni004E",
  "schemaVersion": 1,
  "sourceRevision": "23073ca08ecdac61ad0e838bfae49a590bc2c7cc",
  "stage": "cleaned"
}