{
  "coordinateSpace": "canonical-y-up",
  "fixtureID": "uni0066",
  "outline": {
    "contours": [
      {
        "points": [
          {
            "type": "line",
            "x": 128.0,
            "y": 256.0
          },
          {
            "type": "line",
            "x": 192.0,
            "y": 256.0
          },
          {
            "type": "line",
            "x": 208.0,
            "y": 272.0
          },
          {
            "type": "line",
            "x": 208.0,
            "y": 744.0
          },
          {
            "type": "line",
            "x": 216.0,
            "y": 752.0
          },
          {
            "type": "line",
            "x": 306.0,
            "y": 752.0
          },
          {
            "type": "line",
            "x": 322.0,
            "y": 768.0
          },
          {
            "type": "line",
            "x": 322.0,
            "y": 816.0
          },
          {
            "type": "line",
            "x": 306.0,
            "y": 832.0
          },
          {
            "type": "line",
            "x": 218.0,
            "y": 832.0
          },
          {
            "type": "line",
            "x": 208.0,
            "y": 840.0
          },
          {
            "smooth": true,
            "type": "line",
            "x": 208.0,
            "y": 874.0
          },
          {
            "x": 208.0,
            "y": 922.0
          },
          {
            "x": 220.0,
            "y": 941.0
          },
          {
            "smooth": true,
            "type": "curve",
            "x": 248.0,
            "y": 942.0
          },
          {
            "type": "line",
            "x": 306.0,
            "y": 944.0
          },
          {
            "type": "line",
            "x": 322.0,
            "y": 960.0
          },
          {
            "type": "line",
            "x": 322.0,
            "y": 1008.0
          },
          {
            "type": "line",
            "x": 306.0,
            "y": 1024.0
          },
          {
            "smooth": true,
            "type": "line",
            "x": 248.0,
            "y": 1024.0
          },
          {
            "x": 164.0,
            "y": 1024.0
          },
          {
            "x": 112.0,
            "y": 985.0
          },
          {
            "smooth": true,
            "type": "curve",
            "x": 112.0,
            "y": 916.0
          },
          {
            "type": "line",
            "x": 112.0,
            "y": 840.0
          },
          {
            "type": "line",
            "x": 104.0,
            "y": 832.0
          },
          {
            "type": "line",
            "x": 40.0,
            "y": 832.0
          },
          {
            "type": "line",
            "x": 24.0,
            "y": 816.0
          },
          {
            "type": "line",
            "x": 24.0,
            "y": 768.0
          },
          {
            "type": "line",
            "x": 40.0,
            "y": 752.0
          },
          {
            "type": "line",
            "x": 104.0,
            "y": 752.0
          },
          {
            "type": "line",
            "x": 112.0,
            "y": 744.0
          },
          {
            "type": "line",
            "x": 112.0,
            "y": 274.0
          }
        ]
      }
    ]
  },
  "schemaVersion": 1,
  "sourceRevision": "23073ca08ecdac61ad0e838bfae49a590bc2c7cc",
  "stage": "validated"
}