{
  "contourIndex": 0,
  "coordinateSpace": "pixel-y-up",
  "fixtureID": "uni005A",
  "path": {
    "elements": [
      {
        "type": "move",
        "x": 10.421482938772707,
        "y": 231.44257917270318
      },
      {
        "type": "line",
        "x": 274.7744621702327,
        "y": 583.8156471374075
      },
      {
        "type": "line",
        "x": 274.2399520339561,
        "y": 594.1080581899834
      },
      {
        "type": "line",
        "x": 28.614668808167227,
        "y": 594.8323521255751
      },
      {
        "type": "line",
        "x": 18.2709654230743,
        "y": 605.2751597200555
      },
      {
        "type": "line",
        "x": 18.244458047311728,
        "y": 648.1076501575727
      },
      {
        "type": "line",
        "x": 28.56838001752027,
        "y": 658.5388413164391
      },
      {
        "type": "line",
        "x": 354.35993713096883,
        "y": 658.6129005788499
      },
      {
        "type": "line",
        "x": 365.0011718424172,
        "y": 648.408490661639
      },
      {
        "type": "line",
        "x": 365.4095515475303,
        "y": 592.7543541114587
      },
      {
        "type": "line",
        "x": 100.67271540104976,
        "y": 239.47287297754195
      },
      {
        "type": "line",
        "x": 100.53546476959964,
        "y": 229.87136923892106
      },
      {
        "type": "line",
        "x": 367.7966781340952,
        "y": 228.700217101946
      },
      {
        "type": "line",
        "x": 377.6612328921175,
        "y": 219.1160928078729
      },
      {
        "type": "line",
        "x": 377.5825848252713,
        "y": 174.4708101694739
      },
      {
        "type": "line",
        "x": 368.48453175039975,
        "y": 165.38788040912334
      },
      {
        "type": "line",
        "x": 20.814410446188923,
        "y": 165.16774446883736
      },
      {
        "type": "line",
        "x": 10.441816399954357,
        "y": 175.60642597333808
      },
      {
        "type": "line",
        "x": 10.421482938772707,
        "y": 231.44257917270318
      },
      {
        "type": "close"
      }
    ]
  },
  "schemaVersion": 1,
  "sourceRevision": "23073ca08ecdac61ad0e838bfae49a590bc2c7cc",
  "stage": "initialFit"
}