{
  "contours": [
    {
      "closed": true,
      "index": 0,
      "path": {
        "elements": [
          {
            "type": "move",
            "x": 462.0,
            "y": 788.0
          },
          {
            "points": [
              [
                462.0,
                707.0
              ],
              [
                306.0,
                612.0
              ],
              [
                214.0,
                556.0
              ]
            ],
            "type": "curve"
          },
          {
            "points": [
              [
                111.0,
                493.0
              ],
              [
                32.0,
                394.0
              ],
              [
                32.0,
                282.0
              ]
            ],
            "type": "curve"
          },
          {
            "type": "line",
            "x": 32.0,
            "y": 272.0
          },
          {
            "type": "line",
            "x": 48.0,
            "y": 256.0
          },
          {
            "type": "line",
            "x": 528.0,
            "y": 258.0
          },
          {
            "type": "line",
            "x": 544.0,
            "y": 272.0
          },
          {
            "type": "line",
            "x": 544.0,
            "y": 328.0
          },
          {
            "type": "line",
            "x": 528.0,
            "y": 344.0
          },
          {
            "type": "line",
            "x": 160.0,
            "y": 344.0
          },
          {
            "type": "line",
            "x": 152.0,
            "y": 352.0
          },
          {
            "points": [
              [
                141.0,
                389.0
              ],
              [
                261.0,
                478.0
              ],
              [
                300.0,
                502.0
              ]
            ],
            "type": "curve"
          },
          {
            "points": [
              [
                353.0,
                535.0
              ],
              [
                419.0,
                558.0
              ],
              [
                476.0,
                606.0
              ]
            ],
            "type": "curve"
          },
          {
            "points": [
              [
                530.0,
                652.0
              ],
              [
                562.0,
                707.0
              ],
              [
                562.0,
                790.0
              ]
            ],
            "type": "curve"
          },
          {
            "points": [
              [
                562.0,
                941.0
              ],
              [
                456.0,
                1016.0
              ],
              [
                314.0,
                1016.0
              ]
            ],
            "type": "curve"
          },
          {
            "points": [
              [
                160.0,
                1016.0
              ],
              [
                50.0,
                916.0
              ],
              [
                50.0,
                766.0
              ]
            ],
            "type": "curve"
          },
          {
            "type": "line",
            "x": 50.0,
            "y": 756.0
          },
          {
            "type": "line",
            "x": 66.0,
            "y": 740.0
          },
          {
            "type": "line",
            "x": 134.0,
            "y": 740.0
          },
          {
            "type": "line",
            "x": 150.0,
            "y": 756.0
          },
          {
            "points": [
              [
                150.0,
                850.0
              ],
              [
                210.0,
                924.0
              ],
              [
                308.0,
                924.0
              ]
            ],
            "type": "curve"
          },
          {
            "points": [
              [
                389.0,
                924.0
              ],
              [
                462.0,
                873.0
              ],
              [
                462.0,
                788.0
              ]
            ],
            "type": "curve"
          },
          {
            "type": "close"
          }
        ]
      }
    }
  ],
  "coordinateSpace": "canonical-y-up",
  "fixtureID": "uni0032",
  "schemaVersion": 1,
  "sourceRevision": "23073ca08ecdac61ad0e838bfae49a590bc2c7cc",
  "stage": "cleaned"
}