{
  "contourIndex": 0,
  "coordinateSpace": "pixel-y-up",
  "fixtureID": "uni0057",
  "path": {
    "elements": [
      {
        "type": "move",
        "x": 11.229437557619363,
        "y": 643.6776958527562
      },
      {
        "type": "line",
        "x": 25.47557294046955,
        "y": 658.2896349457162
      },
      {
        "type": "line",
        "x": 66.225031911288,
        "y": 658.593340734884
      },
      {
        "type": "line",
        "x": 76.89577909445939,
        "y": 648.3686793233741
      },
      {
        "type": "line",
        "x": 169.6674363615819,
        "y": 247.00005728704238
      },
      {
        "type": "line",
        "x": 181.6674363615819,
        "y": 247.00005728704238
      },
      {
        "type": "line",
        "x": 275.40499345388173,
        "y": 648.0094546765702
      },
      {
        "type": "line",
        "x": 285.84935862908065,
        "y": 658.4561638513068
      },
      {
        "type": "line",
        "x": 357.60959674091686,
        "y": 658.4537290885121
      },
      {
        "type": "line",
        "x": 367.52055681823646,
        "y": 648.793801634017
      },
      {
        "type": "line",
        "x": 459.9688618782727,
        "y": 247.08786552317963
      },
      {
        "type": "line",
        "x": 471.9688618782727,
        "y": 247.08786552317963
      },
      {
        "type": "line",
        "x": 566.4149415368212,
        "y": 648.4382211061978
      },
      {
        "type": "line",
        "x": 577.0584132276653,
        "y": 658.6109739721524
      },
      {
        "type": "line",
        "x": 617.7885717005759,
        "y": 658.2697950608704
      },
      {
        "type": "line",
        "x": 628.461407540188,
        "y": 647.5615949279852
      },
      {
        "type": "line",
        "x": 627.6665517165015,
        "y": 616.6709929260351
      },
      {
        "type": "line",
        "x": 515.7655363986606,
        "y": 175.37279479079052
      },
      {
        "type": "line",
        "x": 503.55578927771273,
        "y": 165.32588289286167
      },
      {
        "type": "line",
        "x": 433.8096187538656,
        "y": 165.16923989523633
      },
      {
        "type": "line",
        "x": 423.3625875955823,
        "y": 175.60703862392864
      },
      {
        "type": "line",
        "x": 328.30848503364365,
        "y": 576.3921124681322
      },
      {
        "type": "line",
        "x": 316.30848503364365,
        "y": 576.3921124681322
      },
      {
        "type": "line",
        "x": 219.76941582353192,
        "y": 175.08078369941464
      },
      {
        "type": "line",
        "x": 210.01864208004773,
        "y": 165.29423303105736
      },
      {
        "type": "line",
        "x": 137.35035522982838,
        "y": 165.39150385851264
      },
      {
        "type": "line",
        "x": 127.57848000978807,
        "y": 175.2204693178549
      },
      {
        "type": "line",
        "x": 11.229437557619363,
        "y": 643.6776958527562
      },
      {
        "type": "close"
      }
    ]
  },
  "schemaVersion": 1,
  "sourceRevision": "23073ca08ecdac61ad0e838bfae49a590bc2c7cc",
  "stage": "rasterRefined"
}