{
  "contourIndex": 0,
  "coordinateSpace": "pixel-y-up",
  "fixtureID": "uni006D",
  "path": {
    "elements": [
      {
        "type": "move",
        "x": 41.39316500652652,
        "y": 524.4297135982498
      },
      {
        "type": "line",
        "x": 51.714525487967116,
        "y": 534.879609749723
      },
      {
        "type": "line",
        "x": 90.45507238992124,
        "y": 534.6335419340661
      },
      {
        "type": "line",
        "x": 100.1711734207398,
        "y": 524.7638946148439
      },
      {
        "points": [
          [
            100.1711734207398,
            520.1461477295131
          ],
          [
            103.62674929666635,
            493.9153896235133
          ],
          [
            107.48417624382854,
            493.9153896235133
          ]
        ],
        "type": "curve"
      },
      {
        "type": "line",
        "x": 109.48417624382854,
        "y": 493.9153896235133
      },
      {
        "points": [
          [
            117.48417624382854,
            493.9153896235133
          ],
          [
            105.03515121584374,
            495.06357713383903
          ],
          [
            126.29650208065048,
            516.7972419616577
          ]
        ],
        "type": "curve"
      },
      {
        "points": [
          [
            146.00823861773142,
            536.9468682857456
          ],
          [
            177.29524628247697,
            545.503937007874
          ],
          [
            206.840153744643,
            545.503937007874
          ]
        ],
        "type": "curve"
      },
      {
        "points": [
          [
            243.19124347538298,
            545.503937007874
          ],
          [
            283.66533967414057,
            534.6904614546147
          ],
          [
            301.34258979867377,
            499.89479553241375
          ]
        ],
        "type": "curve"
      },
      {
        "points": [
          [
            302.8022689072093,
            497.02158243329444
          ],
          [
            303.05116667446396,
            494.0356656445161
          ],
          [
            306.59086083751345,
            494.0356656445161
          ]
        ],
        "type": "curve"
      },
      {
        "points": [
          [
            309.72035340375675,
            494.0356656445161
          ],
          [
            310.2212824419979,
            497.02037214730166
          ],
          [
            311.6722935304196,
            499.1472661891536
          ]
        ],
        "type": "curve"
      },
      {
        "points": [
          [
            335.41753318831724,
            533.9530710198134
          ],
          [
            377.25894817840924,
            545.503937007874
          ],
          [
            417.5304867001304,
            545.503937007874
          ]
        ],
        "type": "curve"
      },
      {
        "points": [
          [
            507.5854498996755,
            545.503937007874
          ],
          [
            551.0785736840753,
            496.45245657630545
          ],
          [
            550.8411458333335,
            394.98225226446783
          ]
        ],
        "type": "curve"
      },
      {
        "type": "line",
        "x": 550.3267194289036,
        "y": 175.1304017009386
      },
      {
        "type": "line",
        "x": 540.5624350796604,
        "y": 165.33377444661517
      },
      {
        "type": "line",
        "x": 493.88452296527333,
        "y": 165.3303151790924
      },
      {
        "type": "line",
        "x": 484.2101129778217,
        "y": 175.16325851483074
      },
      {
        "type": "line",
        "x": 482.58944134217523,
        "y": 417.9671462982619
      },
      {
        "points": [
          [
            482.2784180209005,
            464.56367451274554
          ],
          [
            450.72912289489255,
            488.9960784313725
          ],
          [
            406.7128959429803,
            488.9960784313725
          ]
        ],
        "type": "curve"
      },
      {
        "points": [
          [
            345.74245407254585,
            488.9960784313725
          ],
          [
            329.600799509063,
            450.9233154194629
          ],
          [
            329.51171875,
            396.24179911154306
          ]
        ],
        "type": "curve"
      },
      {
        "type": "line",
        "x": 329.1518192680702,
        "y": 175.3203611112271
      },
      {
        "type": "line",
        "x": 319.5312441499144,
        "y": 165.4136548125538
      },
      {
        "type": "line",
        "x": 272.84018577448194,
        "y": 165.2332900468503
      },
      {
        "type": "line",
        "x": 263.0244200270103,
        "y": 174.9460942939302
      },
      {
        "type": "line",
        "x": 261.2115766416473,
        "y": 417.68254355514426
      },
      {
        "points": [
          [
            260.86406296495505,
            464.2139960959806
          ],
          [
            229.9466684156179,
            488.9960699302782
          ],
          [
            185.69550725555564,
            488.9960699302782
          ]
        ],
        "type": "curve"
      },
      {
        "points": [
          [
            132.43243308991032,
            488.9960699302782
          ],
          [
            108.35163307047134,
            461.47239116902233
          ],
          [
            108.17274518425934,
            400.5450444028476
          ]
        ],
        "type": "curve"
      },
      {
        "type": "line",
        "x": 107.50956055464373,
        "y": 174.67128204700674
      },
      {
        "type": "line",
        "x": 97.60253984594775,
        "y": 165.1091156252404
      },
      {
        "type": "line",
        "x": 51.76675750934645,
        "y": 165.10601916400813
      },
      {
        "type": "line",
        "x": 41.41245059936842,
        "y": 175.51911443852183
      },
      {
        "type": "line",
        "x": 41.39316500652652,
        "y": 524.4297135982498
      },
      {
        "type": "close"
      }
    ]
  },
  "schemaVersion": 1,
  "sourceRevision": "23073ca08ecdac61ad0e838bfae49a590bc2c7cc",
  "stage": "rasterRefined"
}