{
  "coordinateSpace": "canonical-y-up",
  "fixtureID": "uni0049",
  "outline": {
    "contours": [
      {
        "points": [
          {
            "type": "line",
            "x": 96.0,
            "y": 256.0
          },
          {
            "type": "line",
            "x": 168.0,
            "y": 256.0
          },
          {
            "type": "line",
            "x": 184.0,
            "y": 272.0
          },
          {
            "type": "line",
            "x": 184.0,
            "y": 1008.0
          },
          {
            "type": "line",
            "x": 168.0,
            "y": 1024.0
          },
          {
            "type": "line",
            "x": 96.0,
            "y": 1024.0
          },
          {
            "type": "line",
            "x": 80.0,
            "y": 1008.0
          },
          {
            "type": "line",
            "x": 80.0,
            "y": 272.0
          }
        ]
      }
    ]
  },
  "schemaVersion": 1,
  "sourceRevision": "23073ca08ecdac61ad0e838bfae49a590bc2c7cc",
  "stage": "validated"
}