{
  "contourIndex": 0,
  "coordinateSpace": "pixel-y-up",
  "fixtureID": "uni004B",
  "path": {
    "elements": [
      {
        "type": "move",
        "x": 51.83859333297995,
        "y": 648.4051491280369
      },
      {
        "type": "line",
        "x": 61.4732142750687,
        "y": 658.2882570522141
      },
      {
        "type": "line",
        "x": 108.12575401307292,
        "y": 658.2973676810874
      },
      {
        "type": "line",
        "x": 117.93490811225003,
        "y": 648.5123307038025
      },
      {
        "type": "line",
        "x": 118.83052644065278,
        "y": 430.9243670317136
      },
      {
        "type": "line",
        "x": 352.4532137538772,
        "y": 658.4060444823349
      },
      {
        "type": "line",
        "x": 386.1294321143688,
        "y": 658.2956191782365
      },
      {
        "type": "line",
        "x": 395.8157538362991,
        "y": 648.457785614761
      },
      {
        "type": "line",
        "x": 395.79660824322315,
        "y": 617.6986202164959
      },
      {
        "type": "line",
        "x": 241.58219795947414,
        "y": 463.95743304824
      },
      {
        "type": "line",
        "x": 424.67178876372043,
        "y": 204.9340337603635
      },
      {
        "type": "line",
        "x": 424.34126022497,
        "y": 175.1680819755184
      },
      {
        "type": "line",
        "x": 414.5966616390653,
        "y": 165.35940133325644
      },
      {
        "type": "line",
        "x": 371.95470338193104,
        "y": 165.30310844391985
      },
      {
        "type": "line",
        "x": 191.30486307636525,
        "y": 409.1052434770941
      },
      {
        "type": "line",
        "x": 119.05668347941285,
        "y": 340.0955776317509
      },
      {
        "type": "line",
        "x": 118.1831116749813,
        "y": 175.39999155858945
      },
      {
        "type": "line",
        "x": 107.73685659321605,
        "y": 165.08858630971775
      },
      {
        "type": "line",
        "x": 61.91539629892318,
        "y": 165.1375365510924
      },
      {
        "type": "line",
        "x": 52.03897441422211,
        "y": 174.7327253439751
      },
      {
        "type": "line",
        "x": 51.83859333297995,
        "y": 648.4051491280369
      },
      {
        "type": "close"
      }
    ]
  },
  "schemaVersion": 1,
  "sourceRevision": "23073ca08ecdac61ad0e838bfae49a590bc2c7cc",
  "stage": "rasterRefined"
}