{
  "coordinateSpace": "canonical-y-up",
  "fixtureID": "uni0038",
  "outline": {
    "contours": [
      {
        "points": [
          {
            "smooth": true,
            "type": "curve",
            "x": 322.0,
            "y": 240.0
          },
          {
            "x": 517.0,
            "y": 240.0
          },
          {
            "x": 608.0,
            "y": 334.0
          },
          {
            "smooth": true,
            "type": "curve",
            "x": 608.0,
            "y": 468.0
          },
          {
            "x": 608.0,
            "y": 562.0
          },
          {
            "x": 545.0,
            "y": 620.0
          },
          {
            "smooth": true,
            "type": "curve",
            "x": 476.0,
            "y": 660.0
          },
          {
            "type": "line",
            "x": 462.0,
            "y": 668.0
          },
          {
            "x": 551.0,
            "y": 727.0
          },
          {
            "x": 572.0,
            "y": 745.0
          },
          {
            "smooth": true,
            "type": "curve",
            "x": 572.0,
            "y": 824.0
          },
          {
            "x": 572.0,
            "y": 931.0
          },
          {
            "x": 487.0,
            "y": 1016.0
          },
          {
            "smooth": true,
            "type": "curve",
            "x": 320.0,
            "y": 1016.0
          },
          {
            "x": 171.0,
            "y": 1016.0
          },
          {
            "x": 68.0,
            "y": 941.0
          },
          {
            "smooth": true,
            "type": "curve",
            "x": 68.0,
            "y": 824.0
          },
          {
            "x": 68.0,
            "y": 708.0
          },
          {
            "x": 170.0,
            "y": 672.0
          },
          {
            "type": "curve",
            "x": 178.0,
            "y": 672.0
          },
          {
            "type": "line",
            "x": 178.0,
            "y": 664.0
          },
          {
            "x": 129.0,
            "y": 653.0
          },
          {
            "x": 32.0,
            "y": 578.0
          },
          {
            "smooth": true,
            "type": "curve",
            "x": 32.0,
            "y": 468.0
          },
          {
            "x": 32.0,
            "y": 325.0
          },
          {
            "x": 137.0,
            "y": 240.0
          }
        ]
      },
      {
        "points": [
          {
            "smooth": true,
            "type": "curve",
            "x": 320.0,
            "y": 328.0
          },
          {
            "x": 209.0,
            "y": 328.0
          },
          {
            "x": 132.0,
            "y": 383.0
          },
          {
            "smooth": true,
            "type": "curve",
            "x": 132.0,
            "y": 476.0
          },
          {
            "x": 132.0,
            "y": 569.0
          },
          {
            "x": 209.0,
            "y": 624.0
          },
          {
            "smooth": true,
            "type": "curve",
            "x": 320.0,
            "y": 624.0
          },
          {
            "x": 431.0,
            "y": 624.0
          },
          {
            "x": 508.0,
            "y": 569.0
          },
          {
            "smooth": true,
            "type": "curve",
            "x": 508.0,
            "y": 476.0
          },
          {
            "x": 508.0,
            "y": 383.0
          },
          {
            "x": 431.0,
            "y": 328.0
          }
        ]
      },
      {
        "points": [
          {
            "smooth": true,
            "type": "curve",
            "x": 322.0,
            "y": 712.0
          },
          {
            "x": 229.0,
            "y": 712.0
          },
          {
            "x": 168.0,
            "y": 757.0
          },
          {
            "smooth": true,
            "type": "curve",
            "x": 168.0,
            "y": 822.0
          },
          {
            "x": 168.0,
            "y": 886.0
          },
          {
            "x": 224.0,
            "y": 928.0
          },
          {
            "smooth": true,
            "type": "curve",
            "x": 318.0,
            "y": 928.0
          },
          {
            "x": 408.0,
            "y": 928.0
          },
          {
            "x": 472.0,
            "y": 888.0
          },
          {
            "smooth": true,
            "type": "curve",
            "x": 472.0,
            "y": 820.0
          },
          {
            "x": 472.0,
            "y": 754.0
          },
          {
            "x": 412.0,
            "y": 712.0
          }
        ]
      }
    ]
  },
  "schemaVersion": 1,
  "sourceRevision": "23073ca08ecdac61ad0e838bfae49a590bc2c7cc",
  "stage": "validated"
}