{
  "contourIndex": 0,
  "coordinateSpace": "pixel-y-up",
  "fixtureID": "uni0074",
  "path": {
    "elements": [
      {
        "type": "move",
        "x": 10.443914320098985,
        "y": 524.4013630135638
      },
      {
        "type": "line",
        "x": 20.82109044826483,
        "y": 534.8316156562148
      },
      {
        "type": "line",
        "x": 56.552874038595014,
        "y": 535.594390817234
      },
      {
        "type": "line",
        "x": 61.37107990627873,
        "y": 540.3897487707817
      },
      {
        "type": "line",
        "x": 62.31072033543174,
        "y": 628.0515435011733
      },
      {
        "type": "line",
        "x": 72.10541170675111,
        "y": 637.7553119126959
      },
      {
        "type": "line",
        "x": 112.87538876659971,
        "y": 637.8591356381247
      },
      {
        "type": "line",
        "x": 123.23963104121069,
        "y": 627.4625443602537
      },
      {
        "type": "line",
        "x": 123.82650312174518,
        "y": 540.6622518279798
      },
      {
        "type": "line",
        "x": 128.47153911665345,
        "y": 535.7091362232388
      },
      {
        "type": "line",
        "x": 206.11689087937742,
        "y": 534.6592522588465
      },
      {
        "type": "line",
        "x": 215.78555857433102,
        "y": 524.829343458079
      },
      {
        "type": "line",
        "x": 215.75081154205955,
        "y": 489.0853923884233
      },
      {
        "type": "line",
        "x": 206.0364390162089,
        "y": 479.3017694036616
      },
      {
        "type": "line",
        "x": 128.39484926420147,
        "y": 478.24046298041526
      },
      {
        "type": "line",
        "x": 123.8034524370654,
        "y": 473.24846755102254
      },
      {
        "type": "line",
        "x": 124.66156480386965,
        "y": 236.54777161679004
      },
      {
        "points": [
          [
            124.71466131913849,
            221.90169191673607
          ],
          [
            137.69149849127808,
            216.25330176162316
          ],
          [
            152.73832227392424,
            216.16799396753868
          ]
        ],
        "type": "curve"
      },
      {
        "type": "line",
        "x": 205.63356091314887,
        "y": 215.8681050214683
      },
      {
        "type": "line",
        "x": 215.94647768516123,
        "y": 205.4371493411642
      },
      {
        "type": "line",
        "x": 215.9497212402142,
        "y": 175.573044742551
      },
      {
        "type": "line",
        "x": 205.64740710389196,
        "y": 165.13386798344015
      },
      {
        "type": "line",
        "x": 126.79405278749046,
        "y": 165.32112306200298
      },
      {
        "points": [
          [
            72.24031430986342,
            165.45067322094147
          ],
          [
            61.92750704115665,
            205.50533120433295
          ],
          [
            61.832460732984295,
            250.8543795183029
          ]
        ],
        "type": "curve"
      },
      {
        "type": "line",
        "x": 61.36557303696979,
        "y": 473.6185572217061
      },
      {
        "type": "line",
        "x": 56.54180840399507,
        "y": 478.40805872167766
      },
      {
        "type": "line",
        "x": 20.808981078910797,
        "y": 479.1692961439112
      },
      {
        "type": "line",
        "x": 10.441153320901194,
        "y": 489.6090436685612
      },
      {
        "type": "line",
        "x": 10.443914320098985,
        "y": 524.4013630135638
      },
      {
        "type": "close"
      }
    ]
  },
  "schemaVersion": 1,
  "sourceRevision": "23073ca08ecdac61ad0e838bfae49a590bc2c7cc",
  "stage": "initialFit"
}